{
  "version": "context/0.2",
  "meta": {
    "name": "Robot cell — Phase 2: role KPI catalog, form projection, stated→derived promotion (ADR-049)",
    "baseline": null
  },

  "actors": [
    { "ref": "vision_engineer", "role": "developer", "discipline": "vision" },
    { "ref": "robot_engineer",  "role": "developer", "discipline": "robot" }
  ],

  "sources": [
    { "ref": "src_kickoff", "kind": "utterance", "by": "robot_engineer", "capturedAt": "2026-06-13" }
  ],

  "given": [],

  "variables": [
    {
      "ref": "v_working_distance",
      "unit": "mm",
      "domain": [100, 1000],
      "description": "Hand-eye camera working distance"
    }
  ],

  "requirements": [
    {
      "ref": "r_resolution",
      "by": "vision_engineer",
      "kpi": { "name": "resolution", "expr": "3500 / v_working_distance", "unit": "px/mm" },
      "criterion": { "op": ">=", "value": 10 },
      "constrains": ["v_working_distance"],
      "negotiability": "should",
      "admissible": { "interval": [200, 350], "source": "stated" },
      "note": "Closed-form, monotone KPI (resolution = 3500/WD). Phase 2 auto-promotes it stated→derived and derives the admissible region [100,350]"
    },
    {
      "ref": "r_wd_floor",
      "by": "robot_engineer",
      "constrains": ["v_working_distance"],
      "negotiability": "must",
      "admissible": { "interval": [400, 600], "source": "stated" },
      "note": "No KPI backing — R9 asks for the supporting criterion. Does not intersect the promoted r_resolution [100,350]: R6 conflict gap [350,400]"
    }
  ],

  "specification": {
    "layout": {
      "version": "layout/1.0",
      "meta": { "name": "Phase 2 minimal layout", "description": "An empty layout that only checks requirements." },
      "strategy": "manual",
      "entities": [],
      "constraints": []
    },
    "trace": []
  },

  "acceptance": []
}
