{
  "version": "context/0.3",
  "meta": {
    "name": "Robot cell — region Variable, conflict and acceptance-predicate scenario (ADR-049 Phase 3)",
    "baseline": null
  },

  "actors": [
    { "ref": "mech_engineer",   "role": "developer" },
    { "ref": "robot_engineer",  "role": "developer" },
    { "ref": "vision_engineer", "role": "developer" }
  ],

  "sources": [
    { "ref": "src_kickoff",     "kind": "utterance", "by": "robot_engineer", "capturedAt": "2026-06-13" },
    { "ref": "src_zone_sketch", "kind": "sketch",    "by": "mech_engineer",  "capturedAt": "2026-06-13" }
  ],

  "given": [
    {
      "ref": "f_robot",
      "subject": "6-axis robot (10kg payload)",
      "attrs": {
        "reach":     { "value": 850, "unit": "mm" }
      },
      "status": "asserted",
      "evidence": ["src_kickoff"]
    },
    {
      "ref": "f_bolt",
      "subject": "Base plate fixing bolts",
      "attrs": {
        "spec": "M8 assumed"
      },
      "status": "assumed",
      "evidence": ["src_kickoff"]
    }
  ],

  "variables": [
    {
      "ref": "v_base_footprint",
      "unit": "mm",
      "region": {
        "kind": "aabb",
        "axes": ["x", "y"],
        "domain": { "x": [0, 3000], "y": [-1000, 1000] }
      },
      "description": "Installable footprint of the robot base (2D AABB region Variable)"
    },
    {
      "ref": "v_camera_standoff",
      "unit": "mm",
      "domain": [0, 2000],
      "description": "Hand-eye camera working distance (scalar Variable)"
    }
  ],

  "requirements": [
    {
      "ref": "r_vision_footprint",
      "by": "vision_engineer",
      "kpi": { "name": "fovCoverage", "expr": "fov_cover(v_base_footprint)", "unit": "ratio" },
      "criterion": { "op": ">=", "value": 1.0 },
      "constrains": ["v_base_footprint"],
      "negotiability": "should",
      "admissible": { "region": { "x": [600, 1200], "y": [-300, 300] }, "source": "stated" }
    },
    {
      "ref": "r_mech_footprint",
      "by": "mech_engineer",
      "kpi": { "name": "installClearance", "expr": "install_margin(v_base_footprint)", "unit": "mm" },
      "criterion": { "op": ">=", "value": 50 },
      "constrains": ["v_base_footprint"],
      "negotiability": "must",
      "admissible": { "region": { "x": [1300, 1800], "y": [-100, 100] }, "source": "stated" }
    },
    {
      "ref": "r_cam_resolution",
      "by": "vision_engineer",
      "kpi": { "name": "resolution", "expr": "fov_width(v_camera_standoff)", "unit": "px/mm" },
      "criterion": { "op": ">=", "value": 10 },
      "constrains": ["v_camera_standoff"],
      "negotiability": "should",
      "admissible": { "interval": [200, 350], "source": "stated" }
    },
    {
      "ref": "r_wrist_singularity",
      "by": "robot_engineer",
      "kpi": { "name": "singularityMargin", "expr": "wrist_margin(v_camera_standoff)", "unit": "deg" },
      "criterion": { "op": ">=", "value": 15 },
      "constrains": ["v_camera_standoff"],
      "negotiability": "must",
      "admissible": { "interval": [380, 600], "source": "stated" }
    }
  ],

  "decisions": [
    {
      "ref": "d_footprint",
      "resolves": "conflict_v_base_footprint",
      "nominal": { "x": 1250, "y": 0 },
      "decidedBy": ["mech_engineer", "vision_engineer"],
      "status": "proposed",
      "rationale": "A compromise spanning the X no-man's-land [1200,1300]. The field of view is at its edge, but mounting clearance takes priority"
    },
    {
      "ref": "d_standoff",
      "resolves": "conflict_v_camera_standoff",
      "nominal": 400,
      "decidedBy": ["vision_engineer", "robot_engineer"],
      "status": "proposed",
      "rationale": "WD400: keeps the singularity margin. A lens change secures the resolution"
    }
  ],

  "specification": {
    "layout": {
      "version": "layout/1.0",
      "meta": {
        "name": "Robot cell region scenario — minimal layout",
        "description": "Minimal spec containing both the mechanical and the vision admissible mounting zones."
      },
      "strategy": "manual",
      "entities": [
        {
          "ref": "vision_zone",
          "type": "AnnotatedRegion",
          "name": "Field-of-view admissible mounting zone (vision requirement)",
          "placeType": "Zone",
          "vertices": [
            { "x": 600,  "y": -300 },
            { "x": 1200, "y": -300 },
            { "x": 1200, "y":  300 },
            { "x": 600,  "y":  300 }
          ]
        },
        {
          "ref": "mech_zone",
          "type": "AnnotatedRegion",
          "name": "Mounting admissible zone (mechanical requirement)",
          "placeType": "Zone",
          "vertices": [
            { "x": 1300, "y": -100 },
            { "x": 1800, "y": -100 },
            { "x": 1800, "y":  100 },
            { "x": 1300, "y":  100 }
          ]
        }
      ],
      "constraints": []
    },

    "trace": [
      { "from": "r_vision_footprint", "to": "vision_zone", "kind": "constrains" },
      { "from": "r_mech_footprint",   "to": "mech_zone",   "kind": "constrains" }
    ]
  },

  "acceptance": [
    {
      "ref": "a_no_overlap",
      "mode": "static",
      "predicate": {
        "kind": "no_overlap",
        "clearance": 20,
        "boxes": [
          { "ref": "robot",       "x": [0, 220],   "y": [0, 220] },
          { "ref": "container_a", "x": [220, 400], "y": [0, 120] },
          { "ref": "container_b", "x": [220, 400], "y": [120, 240] }
        ],
        "within": { "x": [0, 500], "y": [0, 300] }
      },
      "requires": []
    },
    {
      "ref": "a_reach",
      "mode": "static",
      "predicate": {
        "kind": "reach_covers",
        "envelope": { "shape": "sphere", "center": { "x": 0, "y": 0, "z": 0 }, "radius": 850 },
        "targets": [
          { "ref": "tcp_pick",  "x": 600, "y": 0, "z": 200 },
          { "ref": "tcp_place", "x": 900, "y": 0, "z": 200 }
        ]
      },
      "requires": ["f_robot.attrs.reach"]
    },
    {
      "ref": "a_swept",
      "mode": "static",
      "predicate": {
        "kind": "swept_volume",
        "path": [ { "x": 0, "y": 0, "z": 0 }, { "x": 600, "y": 0, "z": 0 } ],
        "radius": 120,
        "obstacles": [ { "ref": "fence", "x": [900, 920], "y": [-500, 500], "z": [0, 1800] } ],
        "clearance": 10
      },
      "requires": []
    },
    {
      "ref": "a_bolt_clearance",
      "mode": "static",
      "predicate": {
        "kind": "no_overlap",
        "clearance": 5,
        "boxes": [
          { "ref": "plate",  "x": [0, 300], "y": [0, 300] },
          { "ref": "anchor", "x": [310, 360], "y": [0, 50] }
        ]
      },
      "requires": ["f_bolt.spec"]
    }
  ]
}
